tweets,metadata,text,username,id,date,time,timezone,hour
1267589051466625024 2020-06-01 18:49:15 EDT <lgalize4hmanity> Trump said the riots end today. I think Trump's presidency ends today!!!! #blm #RemoveTrumpNow #dcprotests #FirstAmendment #revolution,1267589051466625024 2020-06-01 18:49:15 EDT , Trump said the riots end today. I think Trump's presidency ends today!!!! #blm #RemoveTrumpNow #dcprotests #FirstAmendment #revolution,lgalize4hmanity,1267589051466625024,2020-06-01,2020-06-01 18:49:15,EDT,18
"1267589046588432389 2020-06-01 18:49:14 EDT <andy_martin523> Dear God, he’s going to start a fucking race war. #Trump #DCProtests",1267589046588432389 2020-06-01 18:49:14 EDT ," Dear God, he’s going to start a fucking race war. #Trump #DCProtests",andy_martin523,1267589046588432389,2020-06-01,2020-06-01 18:49:14,EDT,18
1267589039026298886 2020-06-01 18:49:12 EDT <AetherealAura> This is gonna blow up. Stay safe everybody. #RoseGarden #dcprotests #BlackLivesMatter,1267589039026298886 2020-06-01 18:49:12 EDT , This is gonna blow up. Stay safe everybody. #RoseGarden #dcprotests #BlackLivesMatter,AetherealAura,1267589039026298886,2020-06-01,2020-06-01 18:49:12,EDT,18
"1267589035138187272 2020-06-01 18:49:11 EDT <se_parkinson> For those not watching live, DC police and military just horse charged peaceful protestors on live tv #WhiteHouseProtests #DCprotests  pic.twitter.com/slvnYy8Ks7",1267589035138187272 2020-06-01 18:49:11 EDT ," For those not watching live, DC police and military just horse charged peaceful protestors on live tv #WhiteHouseProtests #DCprotests  pic.twitter.com/slvnYy8Ks7",se_parkinson,1267589035138187272,2020-06-01,2020-06-01 18:49:11,EDT,18
1267589033854676992 2020-06-01 18:49:10 EDT <OlderFajardo> POLICE ADVANCING ON PEACEFUL PROTESTERS BEFORE CURFEW IN DC RN #NoJusticeNoPeace #dcprotests #ACAB #RacistInChief https://twitter.com/rebeccamorin_/status/1267588125783711750 …,1267589033854676992 2020-06-01 18:49:10 EDT , POLICE ADVANCING ON PEACEFUL PROTESTERS BEFORE CURFEW IN DC RN #NoJusticeNoPeace #dcprotests #ACAB #RacistInChief https://twitter.com/rebeccamorin_/status/1267588125783711750 …,OlderFajardo,1267589033854676992,2020-06-01,2020-06-01 18:49:10,EDT,18
1267589028393611266 2020-06-01 18:49:09 EDT <CastillaGerman> Am I taking crazy pills here?! What the fuck is Trump talking about... #BUNKERPRESIDENT #AllLivesMatters #laprotest #DCProtests,1267589028393611266 2020-06-01 18:49:09 EDT , Am I taking crazy pills here?! What the fuck is Trump talking about... #BUNKERPRESIDENT #AllLivesMatters #laprotest #DCProtests,CastillaGerman,1267589028393611266,2020-06-01,2020-06-01 18:49:09,EDT,18
1267589000509997058 2020-06-01 18:49:03 EDT <TawniVixen> MT @RealDonaldTrump thinks he can make his own REALITY that's what's crazy dangerous #dcprotests @DCPoliceDept @DCNationalGuard he sounds like Hitler,1267589000509997058 2020-06-01 18:49:03 EDT , MT @RealDonaldTrump thinks he can make his own REALITY that's what's crazy dangerous #dcprotests @DCPoliceDept @DCNationalGuard he sounds like Hitler,TawniVixen,1267589000509997058,2020-06-01,2020-06-01 18:49:03,EDT,18
1267588970981949440 2020-06-01 18:48:56 EDT <namina86_namina> YOU stop being violent Orange!!! #DCProtests #BlackLivesMatter,1267588970981949440 2020-06-01 18:48:56 EDT , YOU stop being violent Orange!!! #DCProtests #BlackLivesMatter,namina86_namina,1267588970981949440,2020-06-01,2020-06-01 18:48:56,EDT,18
1267588968733913099 2020-06-01 18:48:55 EDT <LewisSkolnick3> Donald Trump just defended the YT sword wielding maniac in Dallas who got his ass beat for attacking people. Can you belive this shit? #dcprotests,1267588968733913099 2020-06-01 18:48:55 EDT , Donald Trump just defended the YT sword wielding maniac in Dallas who got his ass beat for attacking people. Can you belive this shit? #dcprotests,LewisSkolnick3,1267588968733913099,2020-06-01,2020-06-01 18:48:55,EDT,18
1267588960701702146 2020-06-01 18:48:53 EDT <redlipcurvyhips> What I'm watching on CNN is disgusting right now #DCProtests,1267588960701702146 2020-06-01 18:48:53 EDT , What I'm watching on CNN is disgusting right now #DCProtests,redlipcurvyhips,1267588960701702146,2020-06-01,2020-06-01 18:48:53,EDT,18
"1267588933761843207 2020-06-01 18:48:47 EDT <manueldevjour> Y mientras Trump habla en el jardín de la Casa Blanca, se pueden escuchar las explosiones en los alrededores. #dcprotests #protests2020 pic.twitter.com/cXfwzvXCVs",1267588933761843207 2020-06-01 18:48:47 EDT ," Y mientras Trump habla en el jardín de la Casa Blanca, se pueden escuchar las explosiones en los alrededores. #dcprotests #protests2020 pic.twitter.com/cXfwzvXCVs",manueldevjour,1267588933761843207,2020-06-01,2020-06-01 18:48:47,EDT,18
"1267588915072032768 2020-06-01 18:48:42 EDT <nacoletti> Echoing this - if you’re stuck at a protest in DC and need to get home, I can get five people $20 each. Reply or DM me! #dcprotests  https://twitter.com/shrimpbizket/status/1267586697312841728 …",1267588915072032768 2020-06-01 18:48:42 EDT ," Echoing this - if you’re stuck at a protest in DC and need to get home, I can get five people $20 each. Reply or DM me! #dcprotests  https://twitter.com/shrimpbizket/status/1267586697312841728 …",nacoletti,1267588915072032768,2020-06-01,2020-06-01 18:48:42,EDT,18
1267588896235421697 2020-06-01 18:48:38 EDT <wozzablog> - wheels hit the road right now #dcprotests,1267588896235421697 2020-06-01 18:48:38 EDT , - wheels hit the road right now #dcprotests,wozzablog,1267588896235421697,2020-06-01,2020-06-01 18:48:38,EDT,18
1267588889293848583 2020-06-01 18:48:36 EDT <thugishbrittney> It’s not even curfew and police are using tear gas and throwing flash bangs like make it make sense bro #dcprotests,1267588889293848583 2020-06-01 18:48:36 EDT , It’s not even curfew and police are using tear gas and throwing flash bangs like make it make sense bro #dcprotests,thugishbrittney,1267588889293848583,2020-06-01,2020-06-01 18:48:36,EDT,18
1267588838647627783 2020-06-01 18:48:24 EDT <nkdpagan> #BlackLivesMatterDC #GeorgeFloyd #riots #DCprotests EVERYONE: The NATIONAL GUARD troops are just protecting their home. All of them are just as disturbed  by Floyds murder as you These are the SAME people you called Heros last Month for their service in Iraq. .,1267588838647627783 2020-06-01 18:48:24 EDT , #BlackLivesMatterDC #GeorgeFloyd #riots #DCprotests EVERYONE: The NATIONAL GUARD troops are just protecting their home. All of them are just as disturbed  by Floyds murder as you These are the SAME people you called Heros last Month for their service in Iraq. .,nkdpagan,1267588838647627783,2020-06-01,2020-06-01 18:48:24,EDT,18
"1267588835145248769 2020-06-01 18:48:23 EDT <kfairwrites> I'm a Christian, but how is this ""a crime against God""? #DCProtests #dcblackout #cnn",1267588835145248769 2020-06-01 18:48:23 EDT ," I'm a Christian, but how is this ""a crime against God""? #DCProtests #dcblackout #cnn",kfairwrites,1267588835145248769,2020-06-01,2020-06-01 18:48:23,EDT,18
"1267588817491542016 2020-06-01 18:48:19 EDT <TKiyro770> How the fuck can you be so blind to your own hypocrisy?! Do you not hear people suffering in the background?????  They aren't the problem, you are!!!! @realDonaldTrump #DCProtests",1267588817491542016 2020-06-01 18:48:19 EDT ," How the fuck can you be so blind to your own hypocrisy?! Do you not hear people suffering in the background?????  They aren't the problem, you are!!!! @realDonaldTrump #DCProtests",TKiyro770,1267588817491542016,2020-06-01,2020-06-01 18:48:19,EDT,18
"1267588814400258049 2020-06-01 18:48:18 EDT <edfischman> Historic moment as the illegitimate, failed, wannabe authoritarian POTUS addresses reporters in White House Rose Garden, while protesters are actually being tear-gassed on streets outside the White House. America will never be the same. #dcprotests #LiberateAmerica #GeorgeFloyd https://twitter.com/maggieNYT/status/1267585840701677569 …",1267588814400258049 2020-06-01 18:48:18 EDT ," Historic moment as the illegitimate, failed, wannabe authoritarian POTUS addresses reporters in White House Rose Garden, while protesters are actually being tear-gassed on streets outside the White House. America will never be the same. #dcprotests #LiberateAmerica #GeorgeFloyd https://twitter.com/maggieNYT/status/1267585840701677569 …",edfischman,1267588814400258049,2020-06-01,2020-06-01 18:48:18,EDT,18
1267588790459260936 2020-06-01 18:48:12 EDT <do_goodd> #protests2020 #GeorgeFloyd #JusticeForGeorgeFloyd #dcprotests #dcprotest #BlackLiveMattters #VoteOutHate https://twitter.com/i/broadcasts/1ypKdQqbYZvGW …,1267588790459260936 2020-06-01 18:48:12 EDT , #protests2020 #GeorgeFloyd #JusticeForGeorgeFloyd #dcprotests #dcprotest #BlackLiveMattters #VoteOutHate https://twitter.com/i/broadcasts/1ypKdQqbYZvGW …,do_goodd,1267588790459260936,2020-06-01,2020-06-01 18:48:12,EDT,18
1267588761619030017 2020-06-01 18:48:06 EDT <FightForUrRitez> Trump said he'd come to speak and instead he attacked the peaceful crowd with heavily armed military. He set them up with false hope. I'm ashamed to call this country home. #FakePresident #DCProtests,1267588761619030017 2020-06-01 18:48:06 EDT , Trump said he'd come to speak and instead he attacked the peaceful crowd with heavily armed military. He set them up with false hope. I'm ashamed to call this country home. #FakePresident #DCProtests,FightForUrRitez,1267588761619030017,2020-06-01,2020-06-01 18:48:06,EDT,18
1267588755319291904 2020-06-01 18:48:04 EDT <monicaredwards> As someone who intensely watched Scandal it would seem as if This Trump address is a distraction #dcprotests,1267588755319291904 2020-06-01 18:48:04 EDT , As someone who intensely watched Scandal it would seem as if This Trump address is a distraction #dcprotests,monicaredwards,1267588755319291904,2020-06-01,2020-06-01 18:48:04,EDT,18
1267588744535777281 2020-06-01 18:48:02 EDT <aaronhuertas> More gas and flashbangs. Police mounted on horses clearing H St. Crowd maintains walking discipline. #dcprotests  pic.twitter.com/eT3hIZwXiB,1267588744535777281 2020-06-01 18:48:02 EDT , More gas and flashbangs. Police mounted on horses clearing H St. Crowd maintains walking discipline. #dcprotests  pic.twitter.com/eT3hIZwXiB,aaronhuertas,1267588744535777281,2020-06-01,2020-06-01 18:48:02,EDT,18
1267588722322784258 2020-06-01 18:47:56 EDT <OlderFajardo> TRUMP WILL BE SPEAKING FROM THE ROSE GARDEN SOON THEY ARE PUSHING PEOPLE BACK SO THEY CANT BE HEARD ON WH GROUNDS STAY SAFE YALL #dcprotests #BlackLivesMatter #RacistInChief https://twitter.com/mrbrownsir/status/1267588018950586369 …,1267588722322784258 2020-06-01 18:47:56 EDT , TRUMP WILL BE SPEAKING FROM THE ROSE GARDEN SOON THEY ARE PUSHING PEOPLE BACK SO THEY CANT BE HEARD ON WH GROUNDS STAY SAFE YALL #dcprotests #BlackLivesMatter #RacistInChief https://twitter.com/mrbrownsir/status/1267588018950586369 …,OlderFajardo,1267588722322784258,2020-06-01,2020-06-01 18:47:56,EDT,18
1267588722133995520 2020-06-01 18:47:56 EDT <ElsaTheActual> #DCProtests DC Livestream⬇️ #MarchWithUs #HumanityFirst #GeorgeFloyd #YangGang https://youtu.be/UrMoqSPZym0,1267588722133995520 2020-06-01 18:47:56 EDT , #DCProtests DC Livestream⬇️ #MarchWithUs #HumanityFirst #GeorgeFloyd #YangGang https://youtu.be/UrMoqSPZym0,ElsaTheActual,1267588722133995520,2020-06-01,2020-06-01 18:47:56,EDT,18
1267588714546397184 2020-06-01 18:47:54 EDT <McDermandKim> As the #TheSupreme Fucker Of All Fucker speaks the forces are shutting down a peaceful protest!!WTF?!??#DCProtests,1267588714546397184 2020-06-01 18:47:54 EDT , As the #TheSupreme Fucker Of All Fucker speaks the forces are shutting down a peaceful protest!!WTF?!??#DCProtests,McDermandKim,1267588714546397184,2020-06-01,2020-06-01 18:47:54,EDT,18
1267588712835276812 2020-06-01 18:47:54 EDT <AZNresister> President of law and order? What a fucking joke. #Idividual1 #ourhouse #rosegarden #dcprotests #dcprotesters #BlackLivesMatter,1267588712835276812 2020-06-01 18:47:54 EDT , President of law and order? What a fucking joke. #Idividual1 #ourhouse #rosegarden #dcprotests #dcprotesters #BlackLivesMatter,AZNresister,1267588712835276812,2020-06-01,2020-06-01 18:47:54,EDT,18
1267588708888272896 2020-06-01 18:47:53 EDT <bsned> Watching DC police and National Guard gas and attack peaceful protesters in broad daylight prior to curfew is chilling. Donald Trump’s America sucks.   #vote #DCProtests #PoliceBrutality #PoliceThePolice #PoliceViolence #PeacefulProtests,1267588708888272896 2020-06-01 18:47:53 EDT , Watching DC police and National Guard gas and attack peaceful protesters in broad daylight prior to curfew is chilling. Donald Trump’s America sucks.   #vote #DCProtests #PoliceBrutality #PoliceThePolice #PoliceViolence #PeacefulProtests,bsned,1267588708888272896,2020-06-01,2020-06-01 18:47:53,EDT,18
1267588683877756931 2020-06-01 18:47:47 EDT <HarveylaNC> The Cheeto is literally talking like a fool. #BunkerBoy called the protestors violent when they were peaceful. #dcprotests,1267588683877756931 2020-06-01 18:47:47 EDT , The Cheeto is literally talking like a fool. #BunkerBoy called the protestors violent when they were peaceful. #dcprotests,HarveylaNC,1267588683877756931,2020-06-01,2020-06-01 18:47:47,EDT,18
1267588677900701696 2020-06-01 18:47:46 EDT <therealco> 16 & I street. #dcprotests  pic.twitter.com/x33CELrn2x,1267588677900701696 2020-06-01 18:47:46 EDT , 16 & I street. #dcprotests  pic.twitter.com/x33CELrn2x,therealco,1267588677900701696,2020-06-01,2020-06-01 18:47:46,EDT,18
1267588650667106304 2020-06-01 18:47:39 EDT <LFerguson1> WTF?  Watching on tv and the protesters were completely peaceful until the police and the military that @realDonaldTrump ordered up advanced and fired tear gas and rubber bullets. This is making me physically ill. #DCProtests #BunkerBoy,1267588650667106304 2020-06-01 18:47:39 EDT , WTF?  Watching on tv and the protesters were completely peaceful until the police and the military that @realDonaldTrump ordered up advanced and fired tear gas and rubber bullets. This is making me physically ill. #DCProtests #BunkerBoy,LFerguson1,1267588650667106304,2020-06-01,2020-06-01 18:47:39,EDT,18
"1267588643679465472 2020-06-01 18:47:37 EDT <LeftwardSwing> 🔴Happening now - The federal government just declared war on people in DC. These protestors were peaceful, marching, singing, federal police rushed them & tear gased them. #BlackLivesMatter #DCProtests  pic.twitter.com/z0UHn5jpv9",1267588643679465472 2020-06-01 18:47:37 EDT ," 🔴Happening now - The federal government just declared war on people in DC. These protestors were peaceful, marching, singing, federal police rushed them & tear gased them. #BlackLivesMatter #DCProtests  pic.twitter.com/z0UHn5jpv9",LeftwardSwing,1267588643679465472,2020-06-01,2020-06-01 18:47:37,EDT,18
1267588640172994560 2020-06-01 18:47:37 EDT <ellie_greene> What country is this? Honestly. #GeorgeFloydProtests #BlackLivesMatter #BLM #DCProtests #AmericaOrTrump #AmericaOnFire https://twitter.com/capehartj/status/1267586166393634818 …,1267588640172994560 2020-06-01 18:47:37 EDT , What country is this? Honestly. #GeorgeFloydProtests #BlackLivesMatter #BLM #DCProtests #AmericaOrTrump #AmericaOnFire https://twitter.com/capehartj/status/1267586166393634818 …,ellie_greene,1267588640172994560,2020-06-01,2020-06-01 18:47:37,EDT,18
1267588522560516101 2020-06-01 18:47:09 EDT <WibbleBinnie> .@realDonaldTrump is a fucking liar. He just said he wants to protect peaceful protesters while he's sent his military force in to attack them.   #FuckYouTrump #DCProtests,1267588522560516101 2020-06-01 18:47:09 EDT , .@realDonaldTrump is a fucking liar. He just said he wants to protect peaceful protesters while he's sent his military force in to attack them.   #FuckYouTrump #DCProtests,WibbleBinnie,1267588522560516101,2020-06-01,2020-06-01 18:47:09,EDT,18
1267588516248256514 2020-06-01 18:47:07 EDT <jessicakathryn> Shame on you @MayorBowser for allowing the police and national guard to attack citizens and incite violence when they were only peacefully protesting. The scene downtown has been entirely started by cops #dcprotests,1267588516248256514 2020-06-01 18:47:07 EDT , Shame on you @MayorBowser for allowing the police and national guard to attack citizens and incite violence when they were only peacefully protesting. The scene downtown has been entirely started by cops #dcprotests,jessicakathryn,1267588516248256514,2020-06-01,2020-06-01 18:47:07,EDT,18
1267588494597091329 2020-06-01 18:47:02 EDT <namina86_namina> The U.S. government is attacking ppl who did nothing wrong and being peaceful!! Can’t believe this!!! They’re peaceful protests!!! #DCProtests #BlackLivesMatter,1267588494597091329 2020-06-01 18:47:02 EDT , The U.S. government is attacking ppl who did nothing wrong and being peaceful!! Can’t believe this!!! They’re peaceful protests!!! #DCProtests #BlackLivesMatter,namina86_namina,1267588494597091329,2020-06-01,2020-06-01 18:47:02,EDT,18
"1267588460258394114 2020-06-01 18:46:54 EDT <manueldevjour> Más imágenes de Washington. Hasta que las calles cercanas no se han despejado, Trump no ha salido a hablar. #dcprotests #protests2020 pic.twitter.com/Ps8UMdSuYn",1267588460258394114 2020-06-01 18:46:54 EDT ," Más imágenes de Washington. Hasta que las calles cercanas no se han despejado, Trump no ha salido a hablar. #dcprotests #protests2020 pic.twitter.com/Ps8UMdSuYn",manueldevjour,1267588460258394114,2020-06-01,2020-06-01 18:46:54,EDT,18
1267588450615582720 2020-06-01 18:46:51 EDT <RandallVC> Watching the #DCProtests   All I am seeing is all these white folks stirring up trouble. They are not helping.🤔  Disclaimer: I’m a 60-year old ‘white’ guy,1267588450615582720 2020-06-01 18:46:51 EDT , Watching the #DCProtests   All I am seeing is all these white folks stirring up trouble. They are not helping.🤔  Disclaimer: I’m a 60-year old ‘white’ guy,RandallVC,1267588450615582720,2020-06-01,2020-06-01 18:46:51,EDT,18
"1267588446769438727 2020-06-01 18:46:51 EDT <AbelPantoja6> While Trump is flapping his gums, police violently pushing protesters #DCProtests #GeorgeFloyd pic.twitter.com/rADp7xH55g",1267588446769438727 2020-06-01 18:46:51 EDT ," While Trump is flapping his gums, police violently pushing protesters #DCProtests #GeorgeFloyd pic.twitter.com/rADp7xH55g",AbelPantoja6,1267588446769438727,2020-06-01,2020-06-01 18:46:51,EDT,18
1267588440943734787 2020-06-01 18:46:49 EDT <bluertide> Mr Asshat you don't even follow the laws of this country. #fucktrump I can't even express my hate for you. #protests2020 #dcprotests #RemoveTrumpNow #whitehousedown,1267588440943734787 2020-06-01 18:46:49 EDT , Mr Asshat you don't even follow the laws of this country. #fucktrump I can't even express my hate for you. #protests2020 #dcprotests #RemoveTrumpNow #whitehousedown,bluertide,1267588440943734787,2020-06-01,2020-06-01 18:46:49,EDT,18
1267588414267850758 2020-06-01 18:46:43 EDT <movebyyourself> And now apparently Trump is about to make live remarks at the White House. Guarantee that’s why they did this before the 7pm curfew. #dcprotests  https://twitter.com/movebyyourself/status/1267586979908194305 …,1267588414267850758 2020-06-01 18:46:43 EDT , And now apparently Trump is about to make live remarks at the White House. Guarantee that’s why they did this before the 7pm curfew. #dcprotests  https://twitter.com/movebyyourself/status/1267586979908194305 …,movebyyourself,1267588414267850758,2020-06-01,2020-06-01 18:46:43,EDT,18
1267588397998247936 2020-06-01 18:46:39 EDT <ssmitty793> This is such a made for tv moment! It might backfire on him! #dcprotests,1267588397998247936 2020-06-01 18:46:39 EDT , This is such a made for tv moment! It might backfire on him! #dcprotests,ssmitty793,1267588397998247936,2020-06-01,2020-06-01 18:46:39,EDT,18
"1267588365223964672 2020-06-01 18:46:31 EDT <ReggieHalstrom> It's so ironic that as Trump claims to support peaceful protestors, when less than 300 yards away, the DC Police is firing tear gas and flashbangs #DCProtests #GeorgeFloydProtests",1267588365223964672 2020-06-01 18:46:31 EDT ," It's so ironic that as Trump claims to support peaceful protestors, when less than 300 yards away, the DC Police is firing tear gas and flashbangs #DCProtests #GeorgeFloydProtests",ReggieHalstrom,1267588365223964672,2020-06-01,2020-06-01 18:46:31,EDT,18
1267588360274468864 2020-06-01 18:46:30 EDT <Zaibaq25> There are no words to describe this ... please watch. #black #amerika #revolt #Uprising2020 #DCProtests  https://twitter.com/bussarebel/status/1267569811782905856 …,1267588360274468864 2020-06-01 18:46:30 EDT , There are no words to describe this ... please watch. #black #amerika #revolt #Uprising2020 #DCProtests  https://twitter.com/bussarebel/status/1267569811782905856 …,Zaibaq25,1267588360274468864,2020-06-01,2020-06-01 18:46:30,EDT,18
1267588348295684096 2020-06-01 18:46:27 EDT <shepersists2> #DCProtests Why don't they just shut off the internet again like last night so we won't know what's happening. #dcblackout,1267588348295684096 2020-06-01 18:46:27 EDT , #DCProtests Why don't they just shut off the internet again like last night so we won't know what's happening. #dcblackout,shepersists2,1267588348295684096,2020-06-01,2020-06-01 18:46:27,EDT,18
1267588340301402114 2020-06-01 18:46:25 EDT <LiveOnMBC> I’m watching an absolutely peaceful protest near the #WhiteHouse being attacked by military police with tear gas.  They are attacking peaceful protesters!   They are attacking peaceful protesters!   #dcprotesters #dcprotests #BLM #BlackLivesMatters,1267588340301402114 2020-06-01 18:46:25 EDT , I’m watching an absolutely peaceful protest near the #WhiteHouse being attacked by military police with tear gas.  They are attacking peaceful protesters!   They are attacking peaceful protesters!   #dcprotesters #dcprotests #BLM #BlackLivesMatters,LiveOnMBC,1267588340301402114,2020-06-01,2020-06-01 18:46:25,EDT,18
1267588304607875072 2020-06-01 18:46:17 EDT <shepersists2> #DCProtests Why don't they just shut off the internet again like last night so we won't know what's happening. #dcblackout,1267588304607875072 2020-06-01 18:46:17 EDT , #DCProtests Why don't they just shut off the internet again like last night so we won't know what's happening. #dcblackout,shepersists2,1267588304607875072,2020-06-01,2020-06-01 18:46:17,EDT,18
"1267588304389586945 2020-06-01 18:46:17 EDT <andy_martin523> ""I'm an ally of all peaceful protesters"" he says after having the police fire tear gas and flashbangs into a peaceful protest. Absolute cunt. #Trump #DCProtests",1267588304389586945 2020-06-01 18:46:17 EDT ," ""I'm an ally of all peaceful protesters"" he says after having the police fire tear gas and flashbangs into a peaceful protest. Absolute cunt. #Trump #DCProtests",andy_martin523,1267588304389586945,2020-06-01,2020-06-01 18:46:17,EDT,18
1267588301944487943 2020-06-01 18:46:16 EDT <NYCsporty> Crazy as President Trump is addressing the nation about the unrest going on across the country & the protestors outside the White House/Rose Garden aren't looting!!!! #DCProtests #GeorgeFloyd #GeorgeFloydProtests https://twitter.com/maggieNYT/status/1267585840701677569 …,1267588301944487943 2020-06-01 18:46:16 EDT , Crazy as President Trump is addressing the nation about the unrest going on across the country & the protestors outside the White House/Rose Garden aren't looting!!!! #DCProtests #GeorgeFloyd #GeorgeFloydProtests https://twitter.com/maggieNYT/status/1267585840701677569 …,NYCsporty,1267588301944487943,2020-06-01,2020-06-01 18:46:16,EDT,18
1267588293652291584 2020-06-01 18:46:14 EDT <idea_woman> Horrified: Watching police attack peaceful protesters in DC as #BunkerBoy gloats on TV   #dcprotesters #dcprotests   Trump got orders from Putin today.    #TrumpLiesPeopleDie,1267588293652291584 2020-06-01 18:46:14 EDT , Horrified: Watching police attack peaceful protesters in DC as #BunkerBoy gloats on TV   #dcprotesters #dcprotests   Trump got orders from Putin today.    #TrumpLiesPeopleDie,idea_woman,1267588293652291584,2020-06-01,2020-06-01 18:46:14,EDT,18
1267588292108746767 2020-06-01 18:46:14 EDT <AlanaZahorak> “I will fight to protect you”. So why is your police force attack peaceful protests? #BlackLivesMatter #DCprotests,1267588292108746767 2020-06-01 18:46:14 EDT , “I will fight to protect you”. So why is your police force attack peaceful protests? #BlackLivesMatter #DCprotests,AlanaZahorak,1267588292108746767,2020-06-01,2020-06-01 18:46:14,EDT,18
1267588275612590083 2020-06-01 18:46:10 EDT <SawTewth> Bombs on the Mic during trump speech at the White House.  #dcprotests,1267588275612590083 2020-06-01 18:46:10 EDT , Bombs on the Mic during trump speech at the White House.  #dcprotests,SawTewth,1267588275612590083,2020-06-01,2020-06-01 18:46:10,EDT,18
1267588268494934019 2020-06-01 18:46:08 EDT <OlderFajardo> THEY HAVE STARTED GASSING PROTESTERS 20 MINUTES BEFORE CURFEW DC FOLLOWERS BE CAREFUL STAY SAFE #dcprotests #BlackLivesMatter https://twitter.com/libraafinest/status/1267587949404868612 …,1267588268494934019 2020-06-01 18:46:08 EDT , THEY HAVE STARTED GASSING PROTESTERS 20 MINUTES BEFORE CURFEW DC FOLLOWERS BE CAREFUL STAY SAFE #dcprotests #BlackLivesMatter https://twitter.com/libraafinest/status/1267587949404868612 …,OlderFajardo,1267588268494934019,2020-06-01,2020-06-01 18:46:08,EDT,18
1267588254276046848 2020-06-01 18:46:05 EDT <Dollemore> Trump is an authoritarian scumbag who is desperate for his own personal Tiananmen Square moment. #DCProtests #dcprotest,1267588254276046848 2020-06-01 18:46:05 EDT , Trump is an authoritarian scumbag who is desperate for his own personal Tiananmen Square moment. #DCProtests #dcprotest,Dollemore,1267588254276046848,2020-06-01,2020-06-01 18:46:05,EDT,18
