tweets,metadata,text,username,id,date,time,timezone,hour
1267479672092311552 2020-06-01 11:34:37 EDT <LaylaBe4> Those are young kids please don't hurt them !! #DCProtests ... #Justice4Floyd https://twitter.com/adamparkhomenko/status/1267251131371212801 …,1267479672092311552 2020-06-01 11:34:37 EDT , Those are young kids please don't hurt them !! #DCProtests ... #Justice4Floyd https://twitter.com/adamparkhomenko/status/1267251131371212801 …,LaylaBe4,1267479672092311552,2020-06-01,2020-06-01 11:34:37,EDT,11
1267479397508034561 2020-06-01 11:33:31 EDT <SmallChimChim> Thank you for this!! I woke to this HT trending and really was like what the hell is going on. Then to see all the bots on the HT. 😳 I've been trying to spread the local news videos and coverage too. ANYWAYS - stay safe!!! #dcprotests #BlackLivesMatter,1267479397508034561 2020-06-01 11:33:31 EDT , Thank you for this!! I woke to this HT trending and really was like what the hell is going on. Then to see all the bots on the HT. 😳 I've been trying to spread the local news videos and coverage too. ANYWAYS - stay safe!!! #dcprotests #BlackLivesMatter,SmallChimChim,1267479397508034561,2020-06-01,2020-06-01 11:33:31,EDT,11
"1267479310111256581 2020-06-01 11:33:10 EDT <AlexCEngler> I'm quoted a few times in @maustermuhle's @DCist article on social media disinformation last night, including what appears to be a propaganda campaign promoting a '# dc blackout' conspiracy theory.   https://dcist.com/story/20/06/01/during-d-c-protests-false-rumors-and-doctored-images-go-viral/ … #dcprotest #dcprotests  pic.twitter.com/h2AKaoBMva",1267479310111256581 2020-06-01 11:33:10 EDT ," I'm quoted a few times in @maustermuhle's @DCist article on social media disinformation last night, including what appears to be a propaganda campaign promoting a '# dc blackout' conspiracy theory.   https://dcist.com/story/20/06/01/during-d-c-protests-false-rumors-and-doctored-images-go-viral/ … #dcprotest #dcprotests  pic.twitter.com/h2AKaoBMva",AlexCEngler,1267479310111256581,2020-06-01,2020-06-01 11:33:10,EDT,11
1267479259980988416 2020-06-01 11:32:58 EDT <Roqo89> #WhiteHouse #dcblackout #DCProtests  pic.twitter.com/uJl8mBNaX7,1267479259980988416 2020-06-01 11:32:58 EDT , #WhiteHouse #dcblackout #DCProtests  pic.twitter.com/uJl8mBNaX7,Roqo89,1267479259980988416,2020-06-01,2020-06-01 11:32:58,EDT,11
1267478766114111488 2020-06-01 11:31:01 EDT <vishy2014> #DCProtests #seattleprotest #Minneapolis #LosAngelesriots #ChicagoProtests retweet this https://twitter.com/tearrahmclovinn/status/1267475402328440832 …,1267478766114111488 2020-06-01 11:31:01 EDT , #DCProtests #seattleprotest #Minneapolis #LosAngelesriots #ChicagoProtests retweet this https://twitter.com/tearrahmclovinn/status/1267475402328440832 …,vishy2014,1267478766114111488,2020-06-01,2020-06-01 11:31:01,EDT,11
1267478653954404352 2020-06-01 11:30:34 EDT <Masraya1979> Talking about testing sites so I guess she just didn't say when in the morning curfew ends #dc #dcprotests,1267478653954404352 2020-06-01 11:30:34 EDT , Talking about testing sites so I guess she just didn't say when in the morning curfew ends #dc #dcprotests,Masraya1979,1267478653954404352,2020-06-01,2020-06-01 11:30:34,EDT,11
1267478138495422465 2020-06-01 11:28:31 EDT <GamingMew115> EVERYONE STAY FAR AWAY FROM DC PROTESTS I DONT CARE WHO U ARE U NEED TO STAY SAFE!!! #dcblackout #dcprotests  pic.twitter.com/WdRGPbnXSl,1267478138495422465 2020-06-01 11:28:31 EDT , EVERYONE STAY FAR AWAY FROM DC PROTESTS I DONT CARE WHO U ARE U NEED TO STAY SAFE!!! #dcblackout #dcprotests  pic.twitter.com/WdRGPbnXSl,GamingMew115,1267478138495422465,2020-06-01,2020-06-01 11:28:31,EDT,11
1267478067578122244 2020-06-01 11:28:14 EDT <philliefan_99> Got a COVID-19 test AND @MayorBowser's press conference. #dc #dcprotests @PoPville @DCist @juliemason pic.twitter.com/1kQHsjsJxu,1267478067578122244 2020-06-01 11:28:14 EDT , Got a COVID-19 test AND @MayorBowser's press conference. #dc #dcprotests @PoPville @DCist @juliemason pic.twitter.com/1kQHsjsJxu,philliefan_99,1267478067578122244,2020-06-01,2020-06-01 11:28:14,EDT,11
"1267478033415323655 2020-06-01 11:28:06 EDT <RandyRhythm> ""WHERE ARE THE PROTESTERS"" #DCProtests #protests2020  What it is... https://youtu.be/B4YwniWerSc",1267478033415323655 2020-06-01 11:28:06 EDT ," ""WHERE ARE THE PROTESTERS"" #DCProtests #protests2020  What it is... https://youtu.be/B4YwniWerSc",RandyRhythm,1267478033415323655,2020-06-01,2020-06-01 11:28:06,EDT,11
1267477858219372549 2020-06-01 11:27:24 EDT <ThomasRachkoJr> Response to this weekend's #DCProtests was in stark contrast to the police escort/protection white supremacists received when they came #LafayetteSquare 2 years ago:    http://www.hrw.org/news/2018/08/14/white-supremacists-see-friend-trump# …  Hate and white supremacy have no place in the #WhiteHouse or in #US policies.,1267477858219372549 2020-06-01 11:27:24 EDT , Response to this weekend's #DCProtests was in stark contrast to the police escort/protection white supremacists received when they came #LafayetteSquare 2 years ago:    http://www.hrw.org/news/2018/08/14/white-supremacists-see-friend-trump# …  Hate and white supremacy have no place in the #WhiteHouse or in #US policies.,ThomasRachkoJr,1267477858219372549,2020-06-01,2020-06-01 11:27:24,EDT,11
1267477813034201089 2020-06-01 11:27:13 EDT <Masraya1979> Can't imagine she means 24 hours for two days but those are her words - live press conference is on WaPo website #dc #dcprotests,1267477813034201089 2020-06-01 11:27:13 EDT , Can't imagine she means 24 hours for two days but those are her words - live press conference is on WaPo website #dc #dcprotests,Masraya1979,1267477813034201089,2020-06-01,2020-06-01 11:27:13,EDT,11
1267477447735422977 2020-06-01 11:25:46 EDT <antblinares> @MayorBowser has issued a curfew in response to #DCProtests. City wide curfew starts at 7 pm and runs for 2 days with no end time mentioned yet.,1267477447735422977 2020-06-01 11:25:46 EDT , @MayorBowser has issued a curfew in response to #DCProtests. City wide curfew starts at 7 pm and runs for 2 days with no end time mentioned yet.,antblinares,1267477447735422977,2020-06-01,2020-06-01 11:25:46,EDT,11
"1267477436335349765 2020-06-01 11:25:44 EDT <CALLISTE> WTF! You mean to tell me #Impeached45 did not go outside White House to greet his guests? He fled to the bunker? Mr. he's so popular, they love them some him, did not walk among the protesters to show his love and support. He was in a bunker? 🙄 😜😄😂🤣✊🏽😷🗽🇺🇸 #DC #DCprotests",1267477436335349765 2020-06-01 11:25:44 EDT ," WTF! You mean to tell me #Impeached45 did not go outside White House to greet his guests? He fled to the bunker? Mr. he's so popular, they love them some him, did not walk among the protesters to show his love and support. He was in a bunker? 🙄 😜😄😂🤣✊🏽😷🗽🇺🇸 #DC #DCprotests",CALLISTE,1267477436335349765,2020-06-01,2020-06-01 11:25:44,EDT,11
1267477235226693633 2020-06-01 11:24:56 EDT <HongKinging> Massacre is now happening in Washington DC. FBI has taken over Twitter and spreaded fake #DCsafe by bots.  REVENGE!  #DCBlockout #JusticeForGeorgeFloyd #GeorgeFloyd #DCProtests,1267477235226693633 2020-06-01 11:24:56 EDT , Massacre is now happening in Washington DC. FBI has taken over Twitter and spreaded fake #DCsafe by bots.  REVENGE!  #DCBlockout #JusticeForGeorgeFloyd #GeorgeFloyd #DCProtests,HongKinging,1267477235226693633,2020-06-01,2020-06-01 11:24:56,EDT,11
1267477167597916163 2020-06-01 11:24:39 EDT <kmfennell1011> This dude really made an account just to troll my tweet about white people being the ones to burn and deface St. John's Church during the #DCProtests,1267477167597916163 2020-06-01 11:24:39 EDT , This dude really made an account just to troll my tweet about white people being the ones to burn and deface St. John's Church during the #DCProtests,kmfennell1011,1267477167597916163,2020-06-01,2020-06-01 11:24:39,EDT,11
"1267477046462218241 2020-06-01 11:24:11 EDT <Masraya1979> Whoa - Bowser says ""curfew will begin at 7pm and will last for 2 days.""  #dcprotests #dc #DCPROTEST",1267477046462218241 2020-06-01 11:24:11 EDT ," Whoa - Bowser says ""curfew will begin at 7pm and will last for 2 days.""  #dcprotests #dc #DCPROTEST",Masraya1979,1267477046462218241,2020-06-01,2020-06-01 11:24:11,EDT,11
1267477029219434496 2020-06-01 11:24:07 EDT <MidwestUSNews> Law enforcement and federal officials say outside elements from both far-right and far-left groups are helping fuel the violence across the country in recent days  #BlackLivesMatter #DCProtests #GeorgeFloyd #JusticeForGeorgeFloyd #Minneapolis #News https://midamericannews.com/?p=1088,1267477029219434496 2020-06-01 11:24:07 EDT , Law enforcement and federal officials say outside elements from both far-right and far-left groups are helping fuel the violence across the country in recent days  #BlackLivesMatter #DCProtests #GeorgeFloyd #JusticeForGeorgeFloyd #Minneapolis #News https://midamericannews.com/?p=1088,MidwestUSNews,1267477029219434496,2020-06-01,2020-06-01 11:24:07,EDT,11
1267476945316569088 2020-06-01 11:23:47 EDT <MidwestUSNews> Updated 11am Monday: Protests and violence continue across the United States of America  #BlackLivesMatter #DCProtests #GeorgeFloyd #JusticeForGeorgeFloyd #Minneapolis #news #Protests #Protests2020 #Riots2020 #USA #USARevolt https://midamericannews.com/?p=1090,1267476945316569088 2020-06-01 11:23:47 EDT , Updated 11am Monday: Protests and violence continue across the United States of America  #BlackLivesMatter #DCProtests #GeorgeFloyd #JusticeForGeorgeFloyd #Minneapolis #news #Protests #Protests2020 #Riots2020 #USA #USARevolt https://midamericannews.com/?p=1090,MidwestUSNews,1267476945316569088,2020-06-01,2020-06-01 11:23:47,EDT,11
"1267476895991357441 2020-06-01 11:23:35 EDT <witch_lad> Don’t let the #DCsafe trick you, the accounts tweeting that they are in DC and it’s safe are hacked or bots, and people saying the protesters are sleeping, all of them? At the same time?? Not ONE is awake? #dcblackout #DCProtests #ACAB #BLM #BlackLivesMatter",1267476895991357441 2020-06-01 11:23:35 EDT ," Don’t let the #DCsafe trick you, the accounts tweeting that they are in DC and it’s safe are hacked or bots, and people saying the protesters are sleeping, all of them? At the same time?? Not ONE is awake? #dcblackout #DCProtests #ACAB #BLM #BlackLivesMatter",witch_lad,1267476895991357441,2020-06-01,2020-06-01 11:23:35,EDT,11
"1267476887443513345 2020-06-01 11:23:33 EDT <CommishDc> If you are not outraged, ask yourself why #blacklivesmatter #blm #peacefulprotest #dcprotests",1267476887443513345 2020-06-01 11:23:33 EDT ," If you are not outraged, ask yourself why #blacklivesmatter #blm #peacefulprotest #dcprotests",CommishDc,1267476887443513345,2020-06-01,2020-06-01 11:23:33,EDT,11
"1267476757847986176 2020-06-01 11:23:02 EDT <kikivonfreaki> Bowser announces 7 pm curfew in Washington, DC. #DCPROTEST #dcprotests #WashingtonDCProtests. We gotta get out there earlier. If you need support today, please DM me. I will help however I can. See you there.",1267476757847986176 2020-06-01 11:23:02 EDT ," Bowser announces 7 pm curfew in Washington, DC. #DCPROTEST #dcprotests #WashingtonDCProtests. We gotta get out there earlier. If you need support today, please DM me. I will help however I can. See you there.",kikivonfreaki,1267476757847986176,2020-06-01,2020-06-01 11:23:02,EDT,11
1267476741121019904 2020-06-01 11:22:58 EDT <MidwestUSNews> The death of George Floyd has ignited protests and violence across the United States of America  #BlackLivesMatter #DCProtests #GeorgeFloyd #JusticeForGeorgeFloyd #Minneapolis #Minnesota #News #Protests #USA #USARevolt https://midamericannews.com/?p=1081,1267476741121019904 2020-06-01 11:22:58 EDT , The death of George Floyd has ignited protests and violence across the United States of America  #BlackLivesMatter #DCProtests #GeorgeFloyd #JusticeForGeorgeFloyd #Minneapolis #Minnesota #News #Protests #USA #USARevolt https://midamericannews.com/?p=1081,MidwestUSNews,1267476741121019904,2020-06-01,2020-06-01 11:22:58,EDT,11
1267476451676184577 2020-06-01 11:21:49 EDT <HongKinging> Massacre is now happening in Washington DC. FBI has taken over Twitter and spreaded fake #DCsafe by bots.  REVENGE!  #DCBlockout #JusticeForGeorgeFloyd #GeorgeFloyd #DCProtests,1267476451676184577 2020-06-01 11:21:49 EDT , Massacre is now happening in Washington DC. FBI has taken over Twitter and spreaded fake #DCsafe by bots.  REVENGE!  #DCBlockout #JusticeForGeorgeFloyd #GeorgeFloyd #DCProtests,HongKinging,1267476451676184577,2020-06-01,2020-06-01 11:21:49,EDT,11
1267476163095605250 2020-06-01 11:20:40 EDT <SouthMichNews> Federal officials say outside elements from far-right and far-left groups are fueling violence across the country  #BlackLivesMatter #DCProtests #GeorgeFloyd #JusticeForGeorgeFloyd #Minneapolis #News #Protests #Protests2020 #Riots2020 #USA #USARevolt https://southernmichigannews.com/watch-extremists-taking-part-in-riots-across-the-united-states/ …,1267476163095605250 2020-06-01 11:20:40 EDT , Federal officials say outside elements from far-right and far-left groups are fueling violence across the country  #BlackLivesMatter #DCProtests #GeorgeFloyd #JusticeForGeorgeFloyd #Minneapolis #News #Protests #Protests2020 #Riots2020 #USA #USARevolt https://southernmichigannews.com/watch-extremists-taking-part-in-riots-across-the-united-states/ …,SouthMichNews,1267476163095605250,2020-06-01,2020-06-01 11:20:40,EDT,11
1267476069998661635 2020-06-01 11:20:18 EDT <HongKinging> Massacre is now happening in Washington DC. FBI has taken over Twitter and spreaded fake #DCsafe by bots.  REVENGE!  #DCBlockout #JusticeForGeorgeFloyd #GeorgeFloyd #DCProtests,1267476069998661635 2020-06-01 11:20:18 EDT , Massacre is now happening in Washington DC. FBI has taken over Twitter and spreaded fake #DCsafe by bots.  REVENGE!  #DCBlockout #JusticeForGeorgeFloyd #GeorgeFloyd #DCProtests,HongKinging,1267476069998661635,2020-06-01,2020-06-01 11:20:18,EDT,11
1267475883268476929 2020-06-01 11:19:33 EDT <antiracist26> I don't know.I urge you to also keep your eyes open and pass on this message by tweeting yourself. Keep active. It's scary and terrifying to see some of the videos that have resurfaced and we will not be cowed down.Stay safe. Stay informed.Stay healthy.  #dcprotests #dcblackout,1267475883268476929 2020-06-01 11:19:33 EDT , I don't know.I urge you to also keep your eyes open and pass on this message by tweeting yourself. Keep active. It's scary and terrifying to see some of the videos that have resurfaced and we will not be cowed down.Stay safe. Stay informed.Stay healthy.  #dcprotests #dcblackout,antiracist26,1267475883268476929,2020-06-01,2020-06-01 11:19:33,EDT,11
"1267475853581053954 2020-06-01 11:19:26 EDT <BuryEst2016> “We put the young ones on the front line, sir, they love it … good practice.”  The Post’s Fact Checker staff observed that, when Trump inserts the word ‘sir’ in a story, “it’s often a sign that he’s telling a fairy tale.”    https://www.washingtonpost.com/opinions/2020/05/31/now-trump-is-twisting-truth-about-dc-police/ … #DCProtests @MurielBowser",1267475853581053954 2020-06-01 11:19:26 EDT ," “We put the young ones on the front line, sir, they love it … good practice.”  The Post’s Fact Checker staff observed that, when Trump inserts the word ‘sir’ in a story, “it’s often a sign that he’s telling a fairy tale.”    https://www.washingtonpost.com/opinions/2020/05/31/now-trump-is-twisting-truth-about-dc-police/ … #DCProtests @MurielBowser",BuryEst2016,1267475853581053954,2020-06-01,2020-06-01 11:19:26,EDT,11
1267475631576502273 2020-06-01 11:18:33 EDT <HongKinging> Massacre is happening in Washington DC. FBI has taken over Twitter and spreaded fake #DCsafe by bots.  REVENGE!  #DCBlockout #JusticeForGeorgeFloyd #GeorgeFloyd #DCProtests,1267475631576502273 2020-06-01 11:18:33 EDT , Massacre is happening in Washington DC. FBI has taken over Twitter and spreaded fake #DCsafe by bots.  REVENGE!  #DCBlockout #JusticeForGeorgeFloyd #GeorgeFloyd #DCProtests,HongKinging,1267475631576502273,2020-06-01,2020-06-01 11:18:33,EDT,11
1267475460180463616 2020-06-01 11:17:52 EDT <ttothe_b> @FordFischer was amazing in his coverage of the #DCProtests      Took bumps and bruises along the way but stuck with it to the end.  Bravo.,1267475460180463616 2020-06-01 11:17:52 EDT , @FordFischer was amazing in his coverage of the #DCProtests      Took bumps and bruises along the way but stuck with it to the end.  Bravo.,ttothe_b,1267475460180463616,2020-06-01,2020-06-01 11:17:52,EDT,11
"1267475402328440832 2020-06-01 11:17:39 EDT <TearrahMclovinn> So they gathered as many protesters as possible and have them in a secluded  area, detained. Not letting them or get anything to eat or drink. #dcblackout #DCProtests #DCsafe #GeorgeFloydprotest https://twitter.com/cooterbooter1/status/1267468859373760512 …",1267475402328440832 2020-06-01 11:17:39 EDT ," So they gathered as many protesters as possible and have them in a secluded  area, detained. Not letting them or get anything to eat or drink. #dcblackout #DCProtests #DCsafe #GeorgeFloydprotest https://twitter.com/cooterbooter1/status/1267468859373760512 …",TearrahMclovinn,1267475402328440832,2020-06-01,2020-06-01 11:17:39,EDT,11
"1267475189316665348 2020-06-01 11:16:48 EDT <MurphskyWurfsky> During D.C. Protests, False Rumors And Doctored Images Go Viral | DCist  #dcprotests  https://dcist.com/story/20/06/01/during-d-c-protests-false-rumors-and-doctored-images-go-viral/ …",1267475189316665348 2020-06-01 11:16:48 EDT ," During D.C. Protests, False Rumors And Doctored Images Go Viral | DCist  #dcprotests  https://dcist.com/story/20/06/01/during-d-c-protests-false-rumors-and-doctored-images-go-viral/ …",MurphskyWurfsky,1267475189316665348,2020-06-01,2020-06-01 11:16:48,EDT,11
"1267475058135457792 2020-06-01 11:16:17 EDT <youbettaresist> Ya know, if MSM has aired footage of #DCProtests we might know where protesters are & what happened last nite. I spent all night begging tv news to cover DC. Someone needs to press the networks abt WHY the were not airing DC protests like all of the other cities. It’s our CAPITOL",1267475058135457792 2020-06-01 11:16:17 EDT ," Ya know, if MSM has aired footage of #DCProtests we might know where protesters are & what happened last nite. I spent all night begging tv news to cover DC. Someone needs to press the networks abt WHY the were not airing DC protests like all of the other cities. It’s our CAPITOL",youbettaresist,1267475058135457792,2020-06-01,2020-06-01 11:16:17,EDT,11
"1267475047612141568 2020-06-01 11:16:14 EDT <Nate1220> To all our brothers and sisters in #dcprotests, we stand by you. Keep that orange skinned motherfucker terrified.",1267475047612141568 2020-06-01 11:16:14 EDT ," To all our brothers and sisters in #dcprotests, we stand by you. Keep that orange skinned motherfucker terrified.",Nate1220,1267475047612141568,2020-06-01,2020-06-01 11:16:14,EDT,11
"1267475038615134208 2020-06-01 11:16:12 EDT <TENerdAnarchist> THE GOVERNMENT IS USING WAR TACTICS AGAINST YOU.  This should be enough to completely demolish any support of the state you have left.  If you still think you need them, PLEASE REACH OUT TO ANARCHISTS. #DCProtests #GoogleVoluntaryism #ACAB",1267475038615134208 2020-06-01 11:16:12 EDT ," THE GOVERNMENT IS USING WAR TACTICS AGAINST YOU.  This should be enough to completely demolish any support of the state you have left.  If you still think you need them, PLEASE REACH OUT TO ANARCHISTS. #DCProtests #GoogleVoluntaryism #ACAB",TENerdAnarchist,1267475038615134208,2020-06-01,2020-06-01 11:16:12,EDT,11
"1267474512733327365 2020-06-01 11:14:07 EDT <Stop_UTK_Now> Trump isn’t the only rich dude hiding in a bunker when things get scary. They all have them, lavishly fitted out, so they can safely hide out from the wars & mass destruction they cause. #DCProtests #riots2020 #BunkerBoy pic.twitter.com/3VvXMJTMqH",1267474512733327365 2020-06-01 11:14:07 EDT ," Trump isn’t the only rich dude hiding in a bunker when things get scary. They all have them, lavishly fitted out, so they can safely hide out from the wars & mass destruction they cause. #DCProtests #riots2020 #BunkerBoy pic.twitter.com/3VvXMJTMqH",Stop_UTK_Now,1267474512733327365,2020-06-01,2020-06-01 11:14:07,EDT,11
1267474470123368449 2020-06-01 11:13:56 EDT <jeisenhart74> Props to this young man and woman. The white woman used her privilege to protect her friend.   #DCProtests  https://twitter.com/adamparkhomenko/status/1267251131371212801 …,1267474470123368449 2020-06-01 11:13:56 EDT , Props to this young man and woman. The white woman used her privilege to protect her friend.   #DCProtests  https://twitter.com/adamparkhomenko/status/1267251131371212801 …,jeisenhart74,1267474470123368449,2020-06-01,2020-06-01 11:13:56,EDT,11
1267474311830401024 2020-06-01 11:13:19 EDT <idrobinhood> Build a Trojan horse as a peace offering at the White House.  We got this shit. Even Troy was more stronger than this weak ass Government. #DCProtests #DC pic.twitter.com/sV2FhQGfTK,1267474311830401024 2020-06-01 11:13:19 EDT , Build a Trojan horse as a peace offering at the White House.  We got this shit. Even Troy was more stronger than this weak ass Government. #DCProtests #DC pic.twitter.com/sV2FhQGfTK,idrobinhood,1267474311830401024,2020-06-01,2020-06-01 11:13:19,EDT,11
1267473956082053123 2020-06-01 11:11:54 EDT <TinaJ89564390> Sorry But Did Anybody See This Topic Just A Few Minutes Ago?  Am I The Only One Who Saw It?  Is that Some Kind of Government Statement Or A Lie? #DCProtests #DCsafe #WashingtonDC pic.twitter.com/xtzL6z5xs1,1267473956082053123 2020-06-01 11:11:54 EDT , Sorry But Did Anybody See This Topic Just A Few Minutes Ago?  Am I The Only One Who Saw It?  Is that Some Kind of Government Statement Or A Lie? #DCProtests #DCsafe #WashingtonDC pic.twitter.com/xtzL6z5xs1,TinaJ89564390,1267473956082053123,2020-06-01,2020-06-01 11:11:54,EDT,11
1267473686036013058 2020-06-01 11:10:49 EDT <isaiahloveyou> Y'all see that dumb fuck get kacked by a rubber bullet on the dome at 0:19? Guess he thought it was a good idea to film the crew push up on secret service... Antifa!  #dcblackout #DCProtests  https://twitter.com/evphoriagguk/status/1267463668591202307 …,1267473686036013058 2020-06-01 11:10:49 EDT , Y'all see that dumb fuck get kacked by a rubber bullet on the dome at 0:19? Guess he thought it was a good idea to film the crew push up on secret service... Antifa!  #dcblackout #DCProtests  https://twitter.com/evphoriagguk/status/1267463668591202307 …,isaiahloveyou,1267473686036013058,2020-06-01,2020-06-01 11:10:49,EDT,11
1267473593644060677 2020-06-01 11:10:27 EDT <ThePurpleLve> Tem gente que esta usando (inclusive eu estava) as hashtags erradas!!  Essas são as hashtags corretas: #Anonymous #VidasPretasImportam #BLACK_LIVE_MATTER #BlackLivesMatter #DCProtests #dcblackout #GeorgeFloyd #GeorgeFloydProtests #ICantBreathe,1267473593644060677 2020-06-01 11:10:27 EDT , Tem gente que esta usando (inclusive eu estava) as hashtags erradas!!  Essas são as hashtags corretas: #Anonymous #VidasPretasImportam #BLACK_LIVE_MATTER #BlackLivesMatter #DCProtests #dcblackout #GeorgeFloyd #GeorgeFloydProtests #ICantBreathe,ThePurpleLve,1267473593644060677,2020-06-01,2020-06-01 11:10:27,EDT,11
1267473557539389443 2020-06-01 11:10:19 EDT <mariejoejr> #DCProtests #VoteOutHate #VoteBlueToSaveAmerica2020 #RegisterToVote #BLACK_LIVES_MATTER pic.twitter.com/Md5BstdwpZ,1267473557539389443 2020-06-01 11:10:19 EDT , #DCProtests #VoteOutHate #VoteBlueToSaveAmerica2020 #RegisterToVote #BLACK_LIVES_MATTER pic.twitter.com/Md5BstdwpZ,mariejoejr,1267473557539389443,2020-06-01,2020-06-01 11:10:19,EDT,11
"1267473388739670022 2020-06-01 11:09:39 EDT <Nope43586196> IF YOU WANT CHANGE, ACT. THERE'S NO OTHER WAY. #DCPROTESTS AND EVERYWHERE #BlackLivesMatter SUPPORT YOUR PEOPLE, WALK, PROTEST, FOR YOUR FRIENDS, FAMILY, STRANGERS AND HUMANITY.",1267473388739670022 2020-06-01 11:09:39 EDT ," IF YOU WANT CHANGE, ACT. THERE'S NO OTHER WAY. #DCPROTESTS AND EVERYWHERE #BlackLivesMatter SUPPORT YOUR PEOPLE, WALK, PROTEST, FOR YOUR FRIENDS, FAMILY, STRANGERS AND HUMANITY.",Nope43586196,1267473388739670022,2020-06-01,2020-06-01 11:09:39,EDT,11
"1267473337082617857 2020-06-01 11:09:26 EDT <kamylar908> Pra que? Pra tentar colocar medo...nós não vamos temer, não vamos ter medo de vocês, vocês deviam ter medo do povo, da humanidade, acho que vocês deviam ter medo de serem quem são,  pra que racismo e matar um negro sem razão? #DCProtests",1267473337082617857 2020-06-01 11:09:26 EDT ," Pra que? Pra tentar colocar medo...nós não vamos temer, não vamos ter medo de vocês, vocês deviam ter medo do povo, da humanidade, acho que vocês deviam ter medo de serem quem são,  pra que racismo e matar um negro sem razão? #DCProtests",kamylar908,1267473337082617857,2020-06-01,2020-06-01 11:09:26,EDT,11
"1267473264949026817 2020-06-01 11:09:09 EDT <blrryfacelive> ""protect the people, not the badge"" ""we will not back down"" ""who do you serve who do you protect"" these were the chants i heard from protesters in front of the white house yesterday. they are just amazing #protests2020 #dcprotests #BlackLivesMatter #acab",1267473264949026817 2020-06-01 11:09:09 EDT ," ""protect the people, not the badge"" ""we will not back down"" ""who do you serve who do you protect"" these were the chants i heard from protesters in front of the white house yesterday. they are just amazing #protests2020 #dcprotests #BlackLivesMatter #acab",blrryfacelive,1267473264949026817,2020-06-01,2020-06-01 11:09:09,EDT,11
