tweets,metadata,text,username,id,date,time,timezone,hour
1267582286796472320 2020-06-01 18:22:22 EDT <TjRauschmier> #Anonymous #WhiteHouseProtests #dcprotesters #DCProtests  https://twitter.com/Acosta/status/1267580162268368896 …,1267582286796472320 2020-06-01 18:22:22 EDT , #Anonymous #WhiteHouseProtests #dcprotesters #DCProtests  https://twitter.com/Acosta/status/1267580162268368896 …,TjRauschmier,1267582286796472320,2020-06-01,2020-06-01 18:22:22,EDT,18
1267582285970358272 2020-06-01 18:22:22 EDT <GrumpyNoMore2> The whole world is watching. #dcprotests,1267582285970358272 2020-06-01 18:22:22 EDT , The whole world is watching. #dcprotests,GrumpyNoMore2,1267582285970358272,2020-06-01,2020-06-01 18:22:22,EDT,18
1267582261702115337 2020-06-01 18:22:16 EDT <luxk07> Bill Barr acting like a general watching over his troops. #dcprotesters #dcprotests #GeorgeFloyd #BlackLivesMatter #AttorneyGeneral #BillBarr pic.twitter.com/hk9wXXAMi1,1267582261702115337 2020-06-01 18:22:16 EDT , Bill Barr acting like a general watching over his troops. #dcprotesters #dcprotests #GeorgeFloyd #BlackLivesMatter #AttorneyGeneral #BillBarr pic.twitter.com/hk9wXXAMi1,luxk07,1267582261702115337,2020-06-01,2020-06-01 18:22:16,EDT,18
1267582255251075075 2020-06-01 18:22:14 EDT <InertCarbonRod> I really hope thr #DCProtests don't go down tonight the way it looks like it's going to. Be careful out there people.,1267582255251075075 2020-06-01 18:22:14 EDT , I really hope thr #DCProtests don't go down tonight the way it looks like it's going to. Be careful out there people.,InertCarbonRod,1267582255251075075,2020-06-01,2020-06-01 18:22:14,EDT,18
1267582180403929090 2020-06-01 18:21:57 EDT <chelsea39630261> Are there any live videos / streams at the #dcprotest #dcprotests #WashingtonDCProtest ?,1267582180403929090 2020-06-01 18:21:57 EDT , Are there any live videos / streams at the #dcprotest #dcprotests #WashingtonDCProtest ?,chelsea39630261,1267582180403929090,2020-06-01,2020-06-01 18:21:57,EDT,18
1267582170924830720 2020-06-01 18:21:54 EDT <TawniVixen> Just to INCITE people   @realDonaldTrump  is going to give some b******* speech #dcprotest @DCPoliceDept @DCNationalGuard #dcprotests #GeorgeFloyd #GeorgeFloydProtest pic.twitter.com/SpePSeUdxm,1267582170924830720 2020-06-01 18:21:54 EDT , Just to INCITE people   @realDonaldTrump  is going to give some b******* speech #dcprotest @DCPoliceDept @DCNationalGuard #dcprotests #GeorgeFloyd #GeorgeFloydProtest pic.twitter.com/SpePSeUdxm,TawniVixen,1267582170924830720,2020-06-01,2020-06-01 18:21:54,EDT,18
1267582130277822465 2020-06-01 18:21:45 EDT <PradaBanks07> Why the fuck is the Attorney General in Lafayette park ?? #dcprotests,1267582130277822465 2020-06-01 18:21:45 EDT , Why the fuck is the Attorney General in Lafayette park ?? #dcprotests,PradaBanks07,1267582130277822465,2020-06-01,2020-06-01 18:21:45,EDT,18
1267582096710619138 2020-06-01 18:21:37 EDT <robbinbythesea> START CHANTING “BUNKER BOY” and “F—K BILL BAR!” #DCProtests,1267582096710619138 2020-06-01 18:21:37 EDT , START CHANTING “BUNKER BOY” and “F—K BILL BAR!” #DCProtests,robbinbythesea,1267582096710619138,2020-06-01,2020-06-01 18:21:37,EDT,18
"1267582041383563264 2020-06-01 18:21:23 EDT <DriskillClaudia> Want to change the tone in D.C.? We just need one military police to kneel and interact with protesters. Come together. Secret Service, Capitol police, UNITE! #WhiteHouse #DCProtests #protests2020 #JusticeForGeorgeFloyd pic.twitter.com/NnWQjixfwu",1267582041383563264 2020-06-01 18:21:23 EDT ," Want to change the tone in D.C.? We just need one military police to kneel and interact with protesters. Come together. Secret Service, Capitol police, UNITE! #WhiteHouse #DCProtests #protests2020 #JusticeForGeorgeFloyd pic.twitter.com/NnWQjixfwu",DriskillClaudia,1267582041383563264,2020-06-01,2020-06-01 18:21:23,EDT,18
1267582039806685184 2020-06-01 18:21:23 EDT <Bushxy> @attorneygeneral at #dcprotests standing there like a bump on a log watching the pain of The People like it's his Monday Entertainment. #protests2020 #bunkerbabytrump #ICantBreathe #mondaythoughts #BlackOutTuesday #TrumpResignNow,1267582039806685184 2020-06-01 18:21:23 EDT , @attorneygeneral at #dcprotests standing there like a bump on a log watching the pain of The People like it's his Monday Entertainment. #protests2020 #bunkerbabytrump #ICantBreathe #mondaythoughts #BlackOutTuesday #TrumpResignNow,Bushxy,1267582039806685184,2020-06-01,2020-06-01 18:21:23,EDT,18
"1267582019569160193 2020-06-01 18:21:18 EDT <bluertide> After a week of zero empathy, this motherfucker is going to come out and stand behind the military and tell us whats wrong with us? FUCK YOU DICKDROP. Choke on yourself. #trumpisdangerous #RemoveTrumpNow  Where's our checks and balances?? #protests2020 #DCsafe #DCProtests",1267582019569160193 2020-06-01 18:21:18 EDT ," After a week of zero empathy, this motherfucker is going to come out and stand behind the military and tell us whats wrong with us? FUCK YOU DICKDROP. Choke on yourself. #trumpisdangerous #RemoveTrumpNow  Where's our checks and balances?? #protests2020 #DCsafe #DCProtests",bluertide,1267582019569160193,2020-06-01,2020-06-01 18:21:18,EDT,18
"1267581939818663937 2020-06-01 18:20:59 EDT <marthaswilson> I’m hearing helicopters overhead at T and 17th streets NW, a mile from the White House.  #dcprotests #BunkerTrump #CowardinChief #EnoughIsEnough https://twitter.com/keithboykin/status/1267573157243879425 …",1267581939818663937 2020-06-01 18:20:59 EDT ," I’m hearing helicopters overhead at T and 17th streets NW, a mile from the White House.  #dcprotests #BunkerTrump #CowardinChief #EnoughIsEnough https://twitter.com/keithboykin/status/1267573157243879425 …",marthaswilson,1267581939818663937,2020-06-01,2020-06-01 18:20:59,EDT,18
"1267581919321096194 2020-06-01 18:20:54 EDT <birrrrrrrrd1> Here is a Livestream of the #DCProtests , please tune in or leave it on, we need as many eyes on DC as we can get right now.  https://twitter.com/nowthisnews/status/1267566732048306178 …",1267581919321096194 2020-06-01 18:20:54 EDT ," Here is a Livestream of the #DCProtests , please tune in or leave it on, we need as many eyes on DC as we can get right now.  https://twitter.com/nowthisnews/status/1267566732048306178 …",birrrrrrrrd1,1267581919321096194,2020-06-01,2020-06-01 18:20:54,EDT,18
1267581919082033153 2020-06-01 18:20:54 EDT <MAndrenov> American military hardware is enroute. All protesters planning on participating in the #DCProtests should go home immediately. This is an extremely dangerous situation and all measures should be taken to prevent loss of life.,1267581919082033153 2020-06-01 18:20:54 EDT , American military hardware is enroute. All protesters planning on participating in the #DCProtests should go home immediately. This is an extremely dangerous situation and all measures should be taken to prevent loss of life.,MAndrenov,1267581919082033153,2020-06-01,2020-06-01 18:20:54,EDT,18
1267581918289125377 2020-06-01 18:20:54 EDT <NMBaudelaire> MPD helicopter over #DCProtests   n911dc on  http://flightradar24.com   https://fr24.com/n911dc/249c933e  #flightradar24,1267581918289125377 2020-06-01 18:20:54 EDT , MPD helicopter over #DCProtests   n911dc on  http://flightradar24.com   https://fr24.com/n911dc/249c933e  #flightradar24,NMBaudelaire,1267581918289125377,2020-06-01,2020-06-01 18:20:54,EDT,18
"1267581887712763907 2020-06-01 18:20:47 EDT <kylahsia> Dad just called to make me promise I'd stay safe at #dcprotests. I told him I'd try, but couldn't promise protests wouldn't escalate.  So think of that before y'all act up. I'm here to stand with black people, not here for your grand theft auto/fight club wet dream.",1267581887712763907 2020-06-01 18:20:47 EDT ," Dad just called to make me promise I'd stay safe at #dcprotests. I told him I'd try, but couldn't promise protests wouldn't escalate.  So think of that before y'all act up. I'm here to stand with black people, not here for your grand theft auto/fight club wet dream.",kylahsia,1267581887712763907,2020-06-01,2020-06-01 18:20:47,EDT,18
1267581819152564226 2020-06-01 18:20:30 EDT <WibbleBinnie> William Barr observing a peaceful protest from behind a line of hundreds of military personnel is making me very anxious. #DCProtests,1267581819152564226 2020-06-01 18:20:30 EDT , William Barr observing a peaceful protest from behind a line of hundreds of military personnel is making me very anxious. #DCProtests,WibbleBinnie,1267581819152564226,2020-06-01,2020-06-01 18:20:30,EDT,18
1267581791147159552 2020-06-01 18:20:24 EDT <spicybutcalm> #DCProtests #dcprotesters HE’S THERE. LET HIM HEAR YOU. BILL BARR IS A RACIST. #BlackLivesMatter #DCProtests  pic.twitter.com/nYQ6G56Q9O,1267581791147159552 2020-06-01 18:20:24 EDT , #DCProtests #dcprotesters HE’S THERE. LET HIM HEAR YOU. BILL BARR IS A RACIST. #BlackLivesMatter #DCProtests  pic.twitter.com/nYQ6G56Q9O,spicybutcalm,1267581791147159552,2020-06-01,2020-06-01 18:20:24,EDT,18
"1267581746582884353 2020-06-01 18:20:13 EDT <therealco> People suddenly began running, allegedly from police in riot gear. #dcprotests  pic.twitter.com/ROwsq2VftU",1267581746582884353 2020-06-01 18:20:13 EDT ," People suddenly began running, allegedly from police in riot gear. #dcprotests  pic.twitter.com/ROwsq2VftU",therealco,1267581746582884353,2020-06-01,2020-06-01 18:20:13,EDT,18
1267581706975887360 2020-06-01 18:20:04 EDT <JeremyDBradley> Just in: Trump was climbing out of the bunker but got wedged in the opening.  #LARiots #LARiots2020 #chicagoprotest #AtlantaRiots #MinneapolisRiot #riots2020 #DCProtests #denverprotests #NYCPROTEST #nycprotests #vegasprotest #bostonprotest #detroitriots,1267581706975887360 2020-06-01 18:20:04 EDT , Just in: Trump was climbing out of the bunker but got wedged in the opening.  #LARiots #LARiots2020 #chicagoprotest #AtlantaRiots #MinneapolisRiot #riots2020 #DCProtests #denverprotests #NYCPROTEST #nycprotests #vegasprotest #bostonprotest #detroitriots,JeremyDBradley,1267581706975887360,2020-06-01,2020-06-01 18:20:04,EDT,18
1267581702555209733 2020-06-01 18:20:03 EDT <Osiris28273352> Trump is scheduled now to speak at 6:30p ET! Dont miss this opportunity! Make @realDonaldTrump and the world hear you! #BeLoud #JusticeForGeorgeFloyd #NoJusticeNoPeace #dcprotesters #dcprotests #whitehouseprotest #BlackLivesMatter #protests2020 #makethisviral https://twitter.com/Osiris28273352/status/1267580479911464963 …,1267581702555209733 2020-06-01 18:20:03 EDT , Trump is scheduled now to speak at 6:30p ET! Dont miss this opportunity! Make @realDonaldTrump and the world hear you! #BeLoud #JusticeForGeorgeFloyd #NoJusticeNoPeace #dcprotesters #dcprotests #whitehouseprotest #BlackLivesMatter #protests2020 #makethisviral https://twitter.com/Osiris28273352/status/1267580479911464963 …,Osiris28273352,1267581702555209733,2020-06-01,2020-06-01 18:20:03,EDT,18
1267581635957932032 2020-06-01 18:19:47 EDT <lylastermind> Seen here with his offensive coordinators #DCProtests  pic.twitter.com/24KZuZDgfQ,1267581635957932032 2020-06-01 18:19:47 EDT , Seen here with his offensive coordinators #DCProtests  pic.twitter.com/24KZuZDgfQ,lylastermind,1267581635957932032,2020-06-01,2020-06-01 18:19:47,EDT,18
1267581501148934146 2020-06-01 18:19:15 EDT <shit_ian_sayss> DC LEGAL AID NUMBER IS 202-888-1731 WRITE IT ON YOUR BODY #dcprotesters #dcprotests #dcprotest #LafayettePark #WhiteHouse #protests2020,1267581501148934146 2020-06-01 18:19:15 EDT , DC LEGAL AID NUMBER IS 202-888-1731 WRITE IT ON YOUR BODY #dcprotesters #dcprotests #dcprotest #LafayettePark #WhiteHouse #protests2020,shit_ian_sayss,1267581501148934146,2020-06-01,2020-06-01 18:19:15,EDT,18
1267581491489280000 2020-06-01 18:19:12 EDT <batatanaz> Here’s the real question. What is going on?? We need to expose them all!  #DCProtests #bunkerbabytrump #Anonymous,1267581491489280000 2020-06-01 18:19:12 EDT , Here’s the real question. What is going on?? We need to expose them all!  #DCProtests #bunkerbabytrump #Anonymous,batatanaz,1267581491489280000,2020-06-01,2020-06-01 18:19:12,EDT,18
1267581445846884353 2020-06-01 18:19:01 EDT <drawntoinsanity> Watching the #DCProtests live and #BillBarr just showing up watching the crows behind police lines,1267581445846884353 2020-06-01 18:19:01 EDT , Watching the #DCProtests live and #BillBarr just showing up watching the crows behind police lines,drawntoinsanity,1267581445846884353,2020-06-01,2020-06-01 18:19:01,EDT,18
1267581391413358600 2020-06-01 18:18:48 EDT <michael_galant> Real normal stuff here at the White House protest #dcprotests  pic.twitter.com/zUhB8k0BxA,1267581391413358600 2020-06-01 18:18:48 EDT , Real normal stuff here at the White House protest #dcprotests  pic.twitter.com/zUhB8k0BxA,michael_galant,1267581391413358600,2020-06-01,2020-06-01 18:18:48,EDT,18
"1267581368575369216 2020-06-01 18:18:43 EDT <ssmitty793> Protesters let the racist leader, Donald, hear you When he speaks!  Bill Barr at front line right now. #DCProtests #NeverTrump",1267581368575369216 2020-06-01 18:18:43 EDT ," Protesters let the racist leader, Donald, hear you When he speaks!  Bill Barr at front line right now. #DCProtests #NeverTrump",ssmitty793,1267581368575369216,2020-06-01,2020-06-01 18:18:43,EDT,18
"1267581265932439554 2020-06-01 18:18:18 EDT <MAndrenov> URGENT: To those planning to participate in the #DCprotests, the U.S Military is being deployed. Advanced military hardware is en-route. Go home immediately. Be advised this is a very dangerous situation. Follow all commands given by authorities. Do not resist.",1267581265932439554 2020-06-01 18:18:18 EDT ," URGENT: To those planning to participate in the #DCprotests, the U.S Military is being deployed. Advanced military hardware is en-route. Go home immediately. Be advised this is a very dangerous situation. Follow all commands given by authorities. Do not resist.",MAndrenov,1267581265932439554,2020-06-01,2020-06-01 18:18:18,EDT,18
"1267581247376822272 2020-06-01 18:18:14 EDT <ahnalee13> #dcprotests something feels wrong. Triple the amount of cops, including military, just joined in the police line. Please stay alert and be careful",1267581247376822272 2020-06-01 18:18:14 EDT ," #dcprotests something feels wrong. Triple the amount of cops, including military, just joined in the police line. Please stay alert and be careful",ahnalee13,1267581247376822272,2020-06-01,2020-06-01 18:18:14,EDT,18
1267581224597565454 2020-06-01 18:18:09 EDT <MrAndersonGov> Wild scene now with AG Bill Barr just feet from the protestors on the north side of Lafayette Park. #DC #dcprotests #ehsgov #ehsapush pic.twitter.com/n8ckjt1JEK,1267581224597565454 2020-06-01 18:18:09 EDT , Wild scene now with AG Bill Barr just feet from the protestors on the north side of Lafayette Park. #DC #dcprotests #ehsgov #ehsapush pic.twitter.com/n8ckjt1JEK,MrAndersonGov,1267581224597565454,2020-06-01,2020-06-01 18:18:09,EDT,18
1267581224236781574 2020-06-01 18:18:09 EDT <EStokesii> This is so scary. @MayorBowser takes one out of Trumps cowardly playbook and brings in the military to defend against PEACEFUL PROTESTORS. Shameful. #BLM #DCProtests  https://twitter.com/cbswalsh/status/1267571404620345353 …,1267581224236781574 2020-06-01 18:18:09 EDT , This is so scary. @MayorBowser takes one out of Trumps cowardly playbook and brings in the military to defend against PEACEFUL PROTESTORS. Shameful. #BLM #DCProtests  https://twitter.com/cbswalsh/status/1267571404620345353 …,EStokesii,1267581224236781574,2020-06-01,2020-06-01 18:18:09,EDT,18
1267581221271408645 2020-06-01 18:18:08 EDT <Aly_Dar8> Anyone else find it interesting that Trump is going to address the crowd right before curfew starts? Almost as if it's a trap… 😠 #dccurfew #dcprotests #dcprotest,1267581221271408645 2020-06-01 18:18:08 EDT , Anyone else find it interesting that Trump is going to address the crowd right before curfew starts? Almost as if it's a trap… 😠 #dccurfew #dcprotests #dcprotest,Aly_Dar8,1267581221271408645,2020-06-01,2020-06-01 18:18:08,EDT,18
1267581212442460166 2020-06-01 18:18:06 EDT <sovanyio> Be careful tonight y'all #dcprotests @realDonaldTrump is trying to act like a big boy tonight,1267581212442460166 2020-06-01 18:18:06 EDT , Be careful tonight y'all #dcprotests @realDonaldTrump is trying to act like a big boy tonight,sovanyio,1267581212442460166,2020-06-01,2020-06-01 18:18:06,EDT,18
1267581186840367112 2020-06-01 18:18:00 EDT <theluisdiaz> Piece of shit Bill Barr wants to see what’s up. #dcprotests,1267581186840367112 2020-06-01 18:18:00 EDT , Piece of shit Bill Barr wants to see what’s up. #dcprotests,theluisdiaz,1267581186840367112,2020-06-01,2020-06-01 18:18:00,EDT,18
1267581167236050946 2020-06-01 18:17:55 EDT <matrbk> Why the Fuck is the Atty General standing behind the police line at the WH right now? Nothing good will come out of this press conference #DCProtests  https://twitter.com/realdonaldtrump/status/1267580557141184513 …,1267581167236050946 2020-06-01 18:17:55 EDT , Why the Fuck is the Atty General standing behind the police line at the WH right now? Nothing good will come out of this press conference #DCProtests  https://twitter.com/realdonaldtrump/status/1267580557141184513 …,matrbk,1267581167236050946,2020-06-01,2020-06-01 18:17:55,EDT,18
1267581018258706432 2020-06-01 18:17:19 EDT <RodriguezBecca> Please chant George Floyd’s name so loudly it drowns out the speech. #protests2020 #blacklivesmatter #washingtondc #dcprotests #GeorgeFloyd,1267581018258706432 2020-06-01 18:17:19 EDT , Please chant George Floyd’s name so loudly it drowns out the speech. #protests2020 #blacklivesmatter #washingtondc #dcprotests #GeorgeFloyd,RodriguezBecca,1267581018258706432,2020-06-01,2020-06-01 18:17:19,EDT,18
"1267581002186178562 2020-06-01 18:17:16 EDT <ddubau86> One is not like the other, prime example that the police are not even smart enough to hold the sign the correct way.  #dcprotests #WashingtonDCProtest #BlackLivesMatter pic.twitter.com/IDg70Kvuau",1267581002186178562 2020-06-01 18:17:16 EDT ," One is not like the other, prime example that the police are not even smart enough to hold the sign the correct way.  #dcprotests #WashingtonDCProtest #BlackLivesMatter pic.twitter.com/IDg70Kvuau",ddubau86,1267581002186178562,2020-06-01,2020-06-01 18:17:16,EDT,18
1267581000038658048 2020-06-01 18:17:15 EDT <spazzytura> Live protest at DC #BlackLivesMatter #BLACK_LIVES_MATTER #ICannotBreath #ACAB #dcprotesters #dcprotests #pride https://youtu.be/PhMS0QkgDvQ,1267581000038658048 2020-06-01 18:17:15 EDT , Live protest at DC #BlackLivesMatter #BLACK_LIVES_MATTER #ICannotBreath #ACAB #dcprotesters #dcprotests #pride https://youtu.be/PhMS0QkgDvQ,spazzytura,1267581000038658048,2020-06-01,2020-06-01 18:17:15,EDT,18
1267580945097355266 2020-06-01 18:17:02 EDT <KimMcDermand> Yo y’all I have been watching the DC protest all morning.. not forces have been called in and all of a sudden my feed goes down.. everything has been peaceful up to this point..#DCProtests #dcblackout,1267580945097355266 2020-06-01 18:17:02 EDT , Yo y’all I have been watching the DC protest all morning.. not forces have been called in and all of a sudden my feed goes down.. everything has been peaceful up to this point..#DCProtests #dcblackout,KimMcDermand,1267580945097355266,2020-06-01,2020-06-01 18:17:02,EDT,18
1267580735340318726 2020-06-01 18:16:12 EDT <LisMeyers> Came to Lafayette Park after work. We are here peacefully protesting with the numbers growing. Yet the police & military presence is growing by the second. It’s terrifying. #dcprotests #protests2020 #GeorgeLloyd #BlackLivesMatter #HandsUpDontShoot pic.twitter.com/9hEJKoqBcI,1267580735340318726 2020-06-01 18:16:12 EDT , Came to Lafayette Park after work. We are here peacefully protesting with the numbers growing. Yet the police & military presence is growing by the second. It’s terrifying. #dcprotests #protests2020 #GeorgeLloyd #BlackLivesMatter #HandsUpDontShoot pic.twitter.com/9hEJKoqBcI,LisMeyers,1267580735340318726,2020-06-01,2020-06-01 18:16:12,EDT,18
1267580689597304832 2020-06-01 18:16:01 EDT <TKiyro770> The last thing those protesters need right now is for Trump's dumbass to go out there and run his mouth. This stand off is tense enough as is... #DCProtests #protests2020 pic.twitter.com/bSQV5uhpeb,1267580689597304832 2020-06-01 18:16:01 EDT , The last thing those protesters need right now is for Trump's dumbass to go out there and run his mouth. This stand off is tense enough as is... #DCProtests #protests2020 pic.twitter.com/bSQV5uhpeb,TKiyro770,1267580689597304832,2020-06-01,2020-06-01 18:16:01,EDT,18
"1267580651009703938 2020-06-01 18:15:52 EDT <MaptheP> Protestors chant ""Say his name! #GeorgeFloyd!"" on the steps of the White House in Lafayette Park, #DC #GeorgeFloydWasMurdered #BunkerDon #dcprotests #BlackLivesMatter pic.twitter.com/ZwZoMM0ims",1267580651009703938 2020-06-01 18:15:52 EDT ," Protestors chant ""Say his name! #GeorgeFloyd!"" on the steps of the White House in Lafayette Park, #DC #GeorgeFloydWasMurdered #BunkerDon #dcprotests #BlackLivesMatter pic.twitter.com/ZwZoMM0ims",MaptheP,1267580651009703938,2020-06-01,2020-06-01 18:15:52,EDT,18
1267580609213259777 2020-06-01 18:15:42 EDT <22_Dutch_22> Stand strong!! #DCProtests,1267580609213259777 2020-06-01 18:15:42 EDT , Stand strong!! #DCProtests,22_Dutch_22,1267580609213259777,2020-06-01,2020-06-01 18:15:42,EDT,18
1267580521854439424 2020-06-01 18:15:21 EDT <MissFabuleuse> Make sure y’all vote!. Polls are open until 7pm tonight and 8pm tomorrow. Voters in DC are exempt from the curfew that has been put in place. As long as you’re in line before polls close you will be able to vote. #DMV #dcprotests #vote #DC,1267580521854439424 2020-06-01 18:15:21 EDT , Make sure y’all vote!. Polls are open until 7pm tonight and 8pm tomorrow. Voters in DC are exempt from the curfew that has been put in place. As long as you’re in line before polls close you will be able to vote. #DMV #dcprotests #vote #DC,MissFabuleuse,1267580521854439424,2020-06-01,2020-06-01 18:15:21,EDT,18
1267580499310108673 2020-06-01 18:15:16 EDT <therealco> Protesters standing on top of a park restroom at #dcprotests  pic.twitter.com/Yy1w8Ivlbp,1267580499310108673 2020-06-01 18:15:16 EDT , Protesters standing on top of a park restroom at #dcprotests  pic.twitter.com/Yy1w8Ivlbp,therealco,1267580499310108673,2020-06-01,2020-06-01 18:15:16,EDT,18
1267580477805912065 2020-06-01 18:15:11 EDT <TawniVixen> Just to INCITE people   @realDonaldTrump  is going to give some b******* speech #dcprotest @DCPoliceDept @DCNationalGuard #dcprotests #GeorgeFloyd #GeorgeFloydProtest,1267580477805912065 2020-06-01 18:15:11 EDT , Just to INCITE people   @realDonaldTrump  is going to give some b******* speech #dcprotest @DCPoliceDept @DCNationalGuard #dcprotests #GeorgeFloyd #GeorgeFloydProtest,TawniVixen,1267580477805912065,2020-06-01,2020-06-01 18:15:11,EDT,18
1267580470813843456 2020-06-01 18:15:09 EDT <McDermandKim> #DCProtests #dcblackout Yo y’all I have been watching the DC protest all morning.. not forces have been called in and all of a sudden my feed goes down.. everything has been peaceful up to this point..,1267580470813843456 2020-06-01 18:15:09 EDT , #DCProtests #dcblackout Yo y’all I have been watching the DC protest all morning.. not forces have been called in and all of a sudden my feed goes down.. everything has been peaceful up to this point..,McDermandKim,1267580470813843456,2020-06-01,2020-06-01 18:15:09,EDT,18
"1267580460693102593 2020-06-01 18:15:06 EDT <FarisAlShami17> So many stores and businesses are closed completely or very early (by 6 pm) today in DC and even surrounding suburbs in Virginia and Maryland, likely in anticipation for more protests. #DCprotests",1267580460693102593 2020-06-01 18:15:06 EDT ," So many stores and businesses are closed completely or very early (by 6 pm) today in DC and even surrounding suburbs in Virginia and Maryland, likely in anticipation for more protests. #DCprotests",FarisAlShami17,1267580460693102593,2020-06-01,2020-06-01 18:15:06,EDT,18
1267580446969335809 2020-06-01 18:15:03 EDT <awoman_scorned> The amount of police and military outside the White House right now is unreal. It’s as though #BunkerBoy is afraid of the American people outside his door. #dcprotests #AmericaOrTrump #TrumpResignNow,1267580446969335809 2020-06-01 18:15:03 EDT , The amount of police and military outside the White House right now is unreal. It’s as though #BunkerBoy is afraid of the American people outside his door. #dcprotests #AmericaOrTrump #TrumpResignNow,awoman_scorned,1267580446969335809,2020-06-01,2020-06-01 18:15:03,EDT,18
1267580397317173248 2020-06-01 18:14:51 EDT <promisejoonie> IF U IN DC PLEASE BE SAFE THE NATIONAL GUARD AND MORE HAS COME #BlackLivesMatter #dcprotests  pic.twitter.com/g8VUFRAiyQ,1267580397317173248 2020-06-01 18:14:51 EDT , IF U IN DC PLEASE BE SAFE THE NATIONAL GUARD AND MORE HAS COME #BlackLivesMatter #dcprotests  pic.twitter.com/g8VUFRAiyQ,promisejoonie,1267580397317173248,2020-06-01,2020-06-01 18:14:51,EDT,18
"1267580377582809089 2020-06-01 18:14:47 EDT <TrowelTalk> Who remembers Kent State?  Are we on the verge of that again, in front of the White House? #DCProtests #DumpTrump2020 #GeorgeFloydProtests",1267580377582809089 2020-06-01 18:14:47 EDT ," Who remembers Kent State?  Are we on the verge of that again, in front of the White House? #DCProtests #DumpTrump2020 #GeorgeFloydProtests",TrowelTalk,1267580377582809089,2020-06-01,2020-06-01 18:14:47,EDT,18
